{
  "format": "llm-field-notes/share@1",
  "title": "Sample redacted knowledge graph",
  "nodes": [
    {
      "id": "n0",
      "label": "Retrieval",
      "type": "concept",
      "status": "accepted",
      "confidence": 0.9
    },
    {
      "id": "n1",
      "label": "Grounded answer",
      "type": "concept",
      "status": "inferred",
      "confidence": 0.8
    }
  ],
  "edges": [
    {
      "source": "n0",
      "target": "n1",
      "label": "supports",
      "status": "accepted",
      "confidence": 0.85
    }
  ],
  "documents": 1,
  "reviewed": 1
}
